brand,product,product_type,ingredients,p_id,i_id,n_ingre,n_product,mp_count,mp_percent,mp_present
L'Or√©al Paris,Men Expert Wrinkle De-Crease Day Cream 50 ml,6,Polyquaternium-4,14423,541,6,5751,2040,0.354720918,1
L'Or√©al Paris,Pure Liss Sulphate-Free Shampoo 250 ml,7,Polyquaternium-4,18536,541,2,6040,1970,0.32615894,1
L'Or√©al Paris,Elnett Extra-Volumen Haarspray Haarlack 300 ml,7,Polyquaternium-4,7340,541,2,6040,1970,0.32615894,1
L'Or√©al Paris,Sublime Bronze Zelfbruinende Cr√®me 150 ml,1,Polyquaternium-4,22960,541,2,5393,1941,0.359910996,1
L'Or√©al Paris,Sublime Bronze Zelbruinende Face Spray 75 ml,14,Polyquaternium-4,22958,541,2,2106,763,0.362298196,1
L'Or√©al Paris,Studio Line Hot Curl Thermo Curl Spray 150 ml,7,Polyquaternium-4,22769,541,2,6040,1970,0.32615894,1
L'Or√©al Paris,Skin Perfection Velvety-Soft Toner 200 ml,6,Polyquaternium-4,21649,541,2,5751,2040,0.354720918,1
L'Or√©al Paris,Elvital Hitzeschutz Spray Dream Length 150 ml,7,Polyquaternium-4,7434,541,2,6040,1970,0.32615894,1
L'Or√©al Paris,Men Expert InvisiControl Neat Look Styling Gel 150 ml,7,Polyquaternium-4,14383,541,2,6040,1970,0.32615894,1
L'Or√©al Paris,Everpure Rosemary Moisture Shampoo,7,Polyquaternium-4,7803,541,8,6040,1970,0.32615894,1
L'Or√©al Paris,Skin Paradise Tinted Water Cream - 01 Medium - SPF 20,5,Polyquaternium-4,21634,541,2,1190,488,0.410084034,1
L'Or√©al Paris,Revitalift Cicacr√®me Anti Rimpel Nachtcr√®me 50 ml,6,Polyquaternium-4,19409,541,2,5751,2040,0.354720918,1
L'Or√©al Paris,Perfect Match Highlighter - Rosy Glow (Tube),5,Polyquaternium-4,17499,541,2,1190,488,0.410084034,1
L'Or√©al Paris,–ê–±—Å–æ–ª—é—Ç–Ω–∞—è –ù–µ–∂–Ω–æ—Å—Ç—å –¥–ª—è —Å—É—Ö–æ–π –∏ —á—É–≤—Å—Ç–≤–∏—Ç–µ–ª—å–Ω–æ–π –∫–æ–∂–∏ 200 –º–ª,6,Polyquaternium-4,27071,541,2,5751,2040,0.354720918,1
L'Or√©al Paris,Studio Line Go Create Gelspray Super Strong,7,Polyquaternium-4,22761,541,3,6040,1970,0.32615894,1
L'Or√©al Paris,Shake & Glow Spray Illuminateur 100 ml,5,Polyquaternium-4,20554,541,6,1190,488,0.410084034,1
L'Or√©al Paris,Elnett Satin Hairspray Normal 75 ml,7,Polyquaternium-39,7358,540,3,6040,1970,0.32615894,1
L'Or√©al Paris,The Powder True Match W3 Golden Beige 9 g,5,Polyquaternium-39,24381,540,3,1190,488,0.410084034,1
L'Or√©al Paris,Men Expert Invincible Man 96h Deo Spray 150 ml,3,Polyquaternium-39,14377,540,9,1588,472,0.297229219,1
L'Or√©al Paris,Age Perfect Gesichtswasser 200 ml,6,Polyquaternium-39,679,540,4,5751,2040,0.354720918,1
L'Or√©al Paris,Elnett Satin Extra Sterk Haarspray,7,Polyquaternium-39,7352,540,11,6040,1970,0.32615894,1
L'Or√©al Paris,Studio Line Curl Power Recurling Hair Mousse,7,Polyquaternium-39,22743,540,1,6040,1970,0.32615894,1
L'Or√©al Paris,Sublime Sun Sublime Bronze Milk,1,Polyquaternium-39,22973,540,12,5393,1941,0.359910996,1
L'Or√©al Paris,Age Perfect Cell Renaissance Serum 30 ml,6,Polyquaternium-37,669,539,6,5751,2040,0.354720918,1
L'Or√©al Paris,Effet de Gel Detox Argiles Pures 150 ml,6,Polyquaternium-37,7284,539,3,5751,2040,0.354720918,1
L'Or√©al Paris,Men Expert Fresh Extreme Roll-On 50 ml,3,Polyquaternium-37,14323,539,4,1588,472,0.297229219,1
L'Or√©al Paris,Elvital Regenium Shampoo 250 ml,7,Polyquaternium-37,7443,539,4,6040,1970,0.32615894,1
L'Or√©al Paris,Age Perfect Cleansing Milk 200 ml,6,Polyquaternium-37,671,539,7,5751,2040,0.354720918,1
L'Or√©al Paris,Men Expert Invisible Extreme Fix Gel 150 ml,7,Polyquaternium-37,14381,539,9,6040,1970,0.32615894,1
L'Or√©al Paris,Men Expert Hydra Energetic Gezichtsgel 50 ml,6,Polyquaternium-37,14337,539,5,5751,2040,0.354720918,1
L'Or√©al Paris,Liss Extreme Smoothing Cream 150 ml,7,Polyquaternium-37,13111,539,5,6040,1970,0.32615894,1
L'Or√©al Paris,True Match Foundation,5,Polyquaternium-37,25147,539,4,1190,488,0.410084034,1
L'Or√©al Paris,Elnett Satin Sterke Fixatie Haarlak,7,Polyquaternium-30,7370,537,2,6040,1970,0.32615894,1
L'Or√©al Paris,Elnett Satin Extra Sterk Haarspray,7,Polyquaternium-24,7352,535,11,6040,1970,0.32615894,1
L'Or√©al Paris,Magic Retouch Uitgroei Camoufleerspray 150 ml,7,Polyquaternium-22,13568,534,15,6040,1970,0.32615894,1
L'Or√©al Paris,Lash Paradise 01 White Mascaraprimer 7.2 ml,4,Polyquaternium-22,12600,534,10,630,234,0.371428571,1
L'Or√©al Paris,True Match The One Concealer 1C Ivory Rose 6.8 ml,5,Polyquaternium-22,25166,534,15,1190,488,0.410084034,1
L'Or√©al Paris,Elvital √ñl Magique Doppel Elixier 200 ml,7,Polyquaternium-22,7457,534,9,6040,1970,0.32615894,1
L'Or√©al Paris,Elvital Planta Clear Anti-Schuppen Intensiv 100 ml,7,Polyquaternium-22,7442,534,13,6040,1970,0.32615894,1
L'Or√©al Paris,True Match Foundation 3N Beige Cr√®me 30 ml,5,Polyquaternium-22,25152,534,16,1190,488,0.410084034,1
L'Or√©al Paris,Men Expert Invincible Sport Desodorizante Roll-On 50 ml,3,Polyquaternium-22,14380,534,16,1588,472,0.297229219,1
L'Or√©al Paris,Elvital Color-Glanz 2in1 Shampoo & Sp√ºlung 300 ml,7,Polyquaternium-22,7390,534,15,6040,1970,0.32615894,1
L'Or√©al Paris,Elvital Extraordinary Oil Shampoo 500 ml,7,Polyquaternium-22,7425,534,9,6040,1970,0.32615894,1
L'Or√©al Paris,Age Perfect Pro-Calcium Cr√®me 50 ml,6,Polyquaternium-22,693,534,9,5751,2040,0.354720918,1
L'Or√©al Paris,Infallible Longwear Blush Shaping Stick Buildable Cream Blush Stick 45 Sexy Flush 0.3 oz,11,Polyquaternium-22,11541,534,15,694,255,0.367435159,1
L'Or√©al Paris,Men Expert Hydra Sensitive Shaving Mousse 200 ml,1,Polyquaternium-22,14373,534,20,5393,1941,0.359910996,1
L'Or√©al Paris,Men Expert Hydra Sensitive Shaving Mousse 200 ml,1,Polyquaternium-2,14373,533,20,5393,1941,0.359910996,1
L'Or√©al Paris,Elnett Satin Extra Sterk Haarspray,7,Polyquaternium-2,7352,533,11,6040,1970,0.32615894,1
L'Or√©al Paris,Hair Expertise Ever Pure Hydratatie Gekleurd Haar Cr√®mespoeling 250 ml,7,Polyquaternium-16,10080,532,3,6040,1970,0.32615894,1
L'Or√©al Paris,Elnett Satin Extra Sterk Haarspray,7,Polyquaternium-16,7352,532,11,6040,1970,0.32615894,1
L'Or√©al Paris,Age Perfect Day Cream for mature skin 50 ml,6,Polyquaternium-16,675,532,8,5751,2040,0.354720918,1
L'Or√©al Paris,Make-Up Designer Mega Volume Miss Hippie 01 Black 8.5 ml,4,Polyquaternium-16,13615,532,5,630,234,0.371428571,1
L'Or√©al Paris,Magic Retouch Uitgroeispray Donkerblond 150 ml,7,Polyquaternium-11,13569,531,6,6040,1970,0.32615894,1
L'Or√©al Paris,Skin Paradise Tinted Water Cream - 03 Fair - SPF 20,5,Polyquaternium-11,21635,531,9,1190,488,0.410084034,1
L'Or√©al Paris,True Match Liquid Foundation Make Up,5,Polyquaternium-11,25158,531,7,1190,488,0.410084034,1
L'Or√©al Paris,Studio Line Architect Wax Strong 75 ml,7,Polyquaternium-11,22740,531,3,6040,1970,0.32615894,1
L'Or√©al Paris,Micellaire Gel√©e 125 ml,4,Polyquaternium-10,14891,530,5,630,234,0.371428571,1
L'Or√©al Paris,Studio Line Matt & Messy Sponge 150 ml,7,Polyquaternium-10,22790,530,9,6040,1970,0.32615894,1
L'Or√©al Paris,Excellence Haarfarbe Lichtblond 10 1 stk,7,Polyquaternium-10,7846,530,6,6040,1970,0.32615894,1
L'Or√©al Paris,Colorista Washout Denim Blue 80 ml,7,Polyquaternium-10,5053,530,6,6040,1970,0.32615894,1
L'Or√©al Paris,Stylista Big Hair Spray 150 ml,7,Polyquaternium-10,22928,530,3,6040,1970,0.32615894,1
L'Or√©al Paris,Make-Up Designer Unlimited Mascara Zwart 1 stk,4,Polyquaternium-10,13617,530,5,630,234,0.371428571,1
L'Or√©al Paris,Fine Flowers Cleansing Toner 400 ml,6,Polyquaternium-10,8437,530,3,5751,2040,0.354720918,1
L'Or√©al Paris,True Match 6.N Honey Make-up 30 ml,5,Polyquaternium-10,25145,530,8,1190,488,0.410084034,1
L'Or√©al Paris,Men Expert Invincible Sport 96H Anti-Perspirant Spray Deodorant 250 ml,3,Polyquaternium-10,14378,530,7,1588,472,0.297229219,1
L'Or√©al Paris,Pure Clay Exfoliating Cleansing Gel 150 ml,6,Polyquaternium-10,18457,530,5,5751,2040,0.354720918,1
L'Or√©al Paris,Colorista Washout 10 Turquois 80 ml,7,Polyquaternium-10,5052,530,5,6040,1970,0.32615894,1
L'Or√©al Paris,Botanicals Fresh Care Geranium Hair Conditioner 200 ml,7,Polyquaternium-10,3597,530,9,6040,1970,0.32615894,1
L'Or√©al Paris,Pure Clay Detox Mask 50 ml,6,Polyquaternium-10,18455,530,2,5751,2040,0.354720918,1
L'Or√©al Paris,Anti-Falten Experte 55+ Tagescreme 50 ml,6,Polyquaternium-10,1435,530,3,5751,2040,0.354720918,1
L'Or√©al Paris,Casting Cr√®me Gloss 400 Espresso Middenbruin Haarverf 1 stk,7,Polyquaternium-10,3997,530,4,6040,1970,0.32615894,1
L'Or√©al Paris,La Terra Glam Bronzer 18 g,5,Polyquaternium-10,12505,530,2,1190,488,0.410084034,1
L'Or√©al Paris,Age Perfect Cr√®me 30 ml,6,Polyquaternium-10,672,530,2,5751,2040,0.354720918,1
L'Or√©al Paris,Casting Cr√®me Gloss Haarverf 600 Donkerblond 1 stk,7,Polyquaternium-10,4002,530,5,6040,1970,0.32615894,1
L'Or√©al Paris,Age Perfect Night Cream 2.5 oz,6,Polyquaternium-10,689,530,6,5751,2040,0.354720918,1
L'Or√©al Paris,Studio Line Indestructible KVX96 Gel 300 ml,7,Polyquaternium-10,22773,530,9,6040,1970,0.32615894,1
L'Or√©al Paris,Gentle Make-Up Remover Eye 125 ml,4,Polyquaternium-10,9483,530,7,630,234,0.371428571,1
L'Or√©al Paris,Elnett Luminize Haarspray (extra sterk),7,Polyquaternium-10,7348,530,5,6040,1970,0.32615894,1
L'Or√©al Paris,Elvital Dream Length Restoring Shampoo 400 ml,7,Polyquaternium-10,7411,530,6,6040,1970,0.32615894,1
L'Or√©al Paris,Elnett Satin Hairspray 400ml,7,Polyquaternium-10,7357,530,5,6040,1970,0.32615894,1
L'Or√©al Paris,Studio Line Go Create Gelspray Super Strong,7,Polyquaternium-10,22761,530,3,6040,1970,0.32615894,1
L'Or√©al Paris,C'est Magic BB cream - 01 Very Light,5,Polyquaternium-10,3758,530,6,1190,488,0.410084034,1
L'Or√©al Paris,Hydra Genius Aloe Water 100 ml,6,Polyquaternium-10,11151,530,16,5751,2040,0.354720918,1
L'Or√©al Paris,Revitalift Laser X3 Crema Dia 50 ml,6,Polyquaternium-10,19435,530,4,5751,2040,0.354720918,1
L'Or√©al Paris,Total Repair 5 Shampoo 100 ml,7,Polyquaternium-10,25034,530,6,6040,1970,0.32615894,1
L'Or√©al Paris,Brow Stylist Kabuki Blender Brow Crayon Brunette 0.05 oz,4,Polyquaternium-10,3712,530,9,630,234,0.371428571,1
L'Or√©al Paris,Liss Extreme Smoothing Cream 150 ml,7,Polyquaternium-10,13111,530,5,6040,1970,0.32615894,1
L'Or√©al Paris,Men Expert Pure Power Volcano Face Wash 150 ml,6,Polyquaternium-10,14401,530,1,5751,2040,0.354720918,1
L'Or√©al Paris,Hair Expertise Extraordinary Clay Shampoo 385 ml,7,Polyquaternium-10,10081,530,1,6040,1970,0.32615894,1
L'Or√©al Paris,Elvital Nutri-Gloss Sp√ºlung 200 ml,7,Polyquaternium-10,7440,530,3,6040,1970,0.32615894,1
L'Or√©al Paris,Soft Waterproof Eye and Lip Cleansing Lotion,5,Polyquaternium-10,22139,530,3,1190,488,0.410084034,1
L'Or√©al Paris,Men Expert Hydra Power Gezichtscr√®me 50 ml,6,Polyquaternium-10,14359,530,2,5751,2040,0.354720918,1
L'Or√©al Paris,Ever Curl Hydra Charge Shampoo,7,Polyquaternium-10,7790,530,5,6040,1970,0.32615894,1
L'Or√©al Paris,Studio Line Spurenlos FX Styling Spray Ultra Starker 250 ml,7,Polypropylsilsesquioxane,22811,529,6,6040,1970,0.32615894,1
L'Or√©al Paris,Men Expert Hydra Energetic Shower Gel 300 ml,1,Polypropylsilsesquioxane,14347,529,15,5393,1941,0.359910996,1
L'Or√©al Paris,Make-up Infaillible 24H Matte Cover 175,5,Polypropylsilsesquioxane,13625,529,8,1190,488,0.410084034,1
L'Or√©al Paris,Elvital Color-Gloss Shampoo,7,Polypropylene,7396,527,7,6040,1970,0.32615894,1
L'Or√©al Paris,Pure Clay Charcoal Detox Face Wash 150 ml,6,Polyphosphorylcholine Glycol Acrylate,18453,526,8,5751,2040,0.354720918,1
L'Or√©al Paris,Colorista Spray 1-day Grey 75 ml,7,Polyphosphorylcholine Glycol Acrylate,5047,526,8,6040,1970,0.32615894,1
L'Or√©al Paris,Elnett Satin H√•rspray Kraftig 400 ml,7,Polyphosphorylcholine Glycol Acrylate,7360,526,8,6040,1970,0.32615894,1
L'Or√©al Paris,Age Perfect Cell Renaissance Nachtcreme 50 ml,6,Polymethylsilsesquioxane,668,524,7,5751,2040,0.354720918,1
L'Or√©al Paris,Elvital Color-Vive Hair Mask 300 ml,7,Polymethylsilsesquioxane,7398,524,6,6040,1970,0.32615894,1
L'Or√©al Paris,Revitalift Laser X3 Anti-Ageing Power Serum,6,Polymethylsilsesquioxane,19431,524,7,5751,2040,0.354720918,1
L'Or√©al Paris,Elnett Satin Volume Fixation Hairspray,7,Polymethylsilsesquioxane,7375,524,2,6040,1970,0.32615894,1
L'Or√©al Paris,Volume Million Lashes Fatale Black 9.4 ml,4,Polymethylsilsesquioxane,26209,524,2,630,234,0.371428571,1
L'Or√©al Paris,Studio Line Spurenlos FX Styling Spray Ultra Starker 250 ml,7,Polymethyl Methacrylate,22811,523,6,6040,1970,0.32615894,1
L'Or√©al Paris,Age Perfect Extra-Reichhaltig Manuka Nachtpflege 50 ml,6,Polymethyl Methacrylate,676,523,5,5751,2040,0.354720918,1
L'Or√©al Paris,Men Expert Vita Lift Anti-Aging Eye Care 15 ml,6,Polymethyl Methacrylate,14419,523,5,5751,2040,0.354720918,1
L'Or√©al Paris,Reinigungsmilch Kostbare Bl√ºten 400 ml,6,Polymethyl Methacrylate,19118,523,5,5751,2040,0.354720918,1
L'Or√©al Paris,Casting Cr√®me Gloss 700 Mocha Mania Middenblond Haarkleuring 160 ml,7,Polymethyl Methacrylate,3998,523,1,6040,1970,0.32615894,1
L'Or√©al Paris,Revitalift Filler Anti-Aging Dagcr√®me SPF50 50 ml,6,Polymethyl Methacrylate,19416,523,4,5751,2040,0.354720918,1
L'Or√©al Paris,Revitalift Anti-Wrinkle Day Cream (Fragrance-Free),6,Polymethyl Methacrylate,19406,523,7,5751,2040,0.354720918,1
L'Or√©al Paris,Lash Paradise Volume Maskara Czarna 6.4 ml,4,Polymethyl Methacrylate,12602,523,5,630,234,0.371428571,1
L'Or√©al Paris,Hair Makeup Temporary 1-Day Hair Color Spray 57 g,7,Polymethyl Methacrylate,10101,523,5,6040,1970,0.32615894,1
L'Or√©al Paris,Revitalift Klassik Reinigungsmilch 200 ml,6,Polyisobutene,19429,518,6,5751,2040,0.354720918,1
L'Or√©al Paris,Men Expert Carbon Fix Extreme Hold Paste 75 ml,7,Polyisobutene,14290,518,6,6040,1970,0.32615894,1
L'Or√©al Paris,Advanced Hairstyle Sleek It Iron Straight Heatspray 5.7 oz,7,Polyisobutene,468,518,8,6040,1970,0.32615894,1
L'Or√©al Paris,Revitalift Filler Anti-Aging Dagcr√®me SPF50 50 ml,6,Polyisobutene,19416,518,4,5751,2040,0.354720918,1
L'Or√©al Paris,Elnett Dry Hair Oils Arganolie Haarspray 250 ml,7,Polyisobutene,7339,518,7,6040,1970,0.32615894,1
L'Or√©al Paris,Color Riche Matte Free the Nude Lipstick 02 No Cliche 5 g,11,Polyisobutene,5004,518,7,694,255,0.367435159,1
L'Or√©al Paris,Revitalift Laser X3 Anti-Ageing Power Serum,6,Polyisobutene,19431,518,7,5751,2040,0.354720918,1
L'Or√©al Paris,Revitalift √Åcido Hialur√≥nico Loreal Para Ojos,6,Polyisobutene,19445,518,2,5751,2040,0.354720918,1
L'Or√©al Paris,Infaillible Foundation 120 Vanilla,5,Polyisobutene,11531,518,2,1190,488,0.410084034,1
L'Or√©al Paris,Age Perfect Extra-Reichhaltig Manuka Nachtpflege 50 ml,6,Polyethylene Terephthalate,676,512,5,5751,2040,0.354720918,1
L'Or√©al Paris,Studio Line TXT 01 Shaping Paste Hair Wax 75 ml,7,Polyethylene,22814,510,5,6040,1970,0.32615894,1
L'Or√©al Paris,Age Perfect Eye Cream 15 ml,6,Polyethylene,678,510,6,5751,2040,0.354720918,1
L'Or√©al Paris,Age Perfect Serum Manuka Honing 30 ml,6,Polyethylene,698,510,3,5751,2040,0.354720918,1
L'Or√©al Paris,Elvital Anti-Haarbruch Shampoo 250 ml,7,Polyethylene,7387,510,7,6040,1970,0.32615894,1
L'Or√©al Paris,nfaillible 24hr Freshwear Liquid Foundation 200 Golden Sand 30 ml,5,Polyethylene,16130,510,6,1190,488,0.410084034,1
L'Or√©al Paris,Dermo Expertise Struccante Occhi 125 ml,6,Polyethylene,6560,510,5,5751,2040,0.354720918,1
L'Or√©al Paris,Studio Line Overworked 24H Cream Paste 150 ml,7,Polyethylene,22798,510,5,6040,1970,0.32615894,1
L'Or√©al Paris,Men Expert Hydra Energetic Gel Purifiant 150 ml,6,Polyethylene,14336,510,8,5751,2040,0.354720918,1
L'Or√©al Paris,Wrinkle Expert 55+ Night Cream 50 ml,6,Polyethylene,26656,510,8,5751,2040,0.354720918,1
L'Or√©al Paris,Elvital Volume-Collagen Shampoo 300 ml,7,Polyethylene,7454,510,7,6040,1970,0.32615894,1
L'Or√©al Paris,Studio Line Mineral FX 150 ml,7,Polyethylene,22794,510,5,6040,1970,0.32615894,1
L'Or√©al Paris,Professional Purifying Cleansing Gel 400 ml,8,Polyethylene,18153,510,5,1384,531,0.38367052,1
L'Or√©al Paris,Age Perfect Anti-Rimpel Oogcr√®me 15 ml,6,Polyethylene,665,510,7,5751,2040,0.354720918,1
L'Or√©al Paris,Glam Bronze La Terra 04 Taormina Gezichtspoeder 1 stk,5,Polyethylene,9615,510,10,1190,488,0.410084034,1
L'Or√©al Paris,EverPure Farbpflege Volumen Shampoo 250 ml,7,Polyethylene,7800,510,2,6040,1970,0.32615894,1
L'Or√©al Paris,Magic Skin Beautifier Anti-Redness BB Cream 30 ml,5,Polyethylene,13574,510,8,1190,488,0.410084034,1
L'Or√©al Paris,Advanced Hairstyle Sleek It Iron Straight Heatspray 5.7 oz,7,Polyethylene,468,510,8,6040,1970,0.32615894,1
L'Or√©al Paris,Revitalift Laser X3 Peeling Effect Ampullen 7 stks,6,Polyethylene,19440,510,2,5751,2040,0.354720918,1
L'Or√©al Paris,Magic Shampoo Such√Ω ≈†ampon na Vlasy Citrus Wave 200 ml,7,Polyethylene,13573,510,3,6040,1970,0.32615894,1
L'Or√©al Paris,Color Riche Matte Free the Nude Lipstick 02 No Cliche 5 g,11,Polyethylene,5004,510,7,694,255,0.367435159,1
L'Or√©al Paris,Men Expert Barber Club Beard Hair Styling Cream 75ml,6,Polyethylene,14275,510,7,5751,2040,0.354720918,1
L'Or√©al Paris,Studio Line Invisi Fix gel - Fixation Ultra Forte 150 ml,7,Polyethylene,22781,510,6,6040,1970,0.32615894,1
L'Or√©al Paris,Creme Facial Anti-idade Laser X3 50ml,6,Polyethylene,5551,510,7,5751,2040,0.354720918,1
L'Or√©al Paris,Elvital Color-Gloss Shampoo,7,Polyethylene,7396,510,7,6040,1970,0.32615894,1
L'Or√©al Paris,Elnett Flexible Hairspray,7,Polyethylene,7342,510,3,6040,1970,0.32615894,1
L'Or√©al Paris,Make-up Infaillible 24H Matte Cover 175,5,Polyethylene,13625,510,8,1190,488,0.410084034,1
L'Or√©al Paris,Colorista Hair Colour Hair Make-up Blue Hair for Brunettes 30 ml,7,POLYESTER-5,5040,506,5,6040,1970,0.32615894,1
L'Or√©al Paris,Colorista Hair Colour Hair Make-up Blue Hair for Brunettes 30 ml,7,Polyester,5040,499,5,6040,1970,0.32615894,1
L'Or√©al Paris,Elvital Color-Gloss Shampoo,7,Polycyclopentadiene,7396,495,7,6040,1970,0.32615894,1
L'Or√©al Paris,Skin Care Pure Clay Mask: Exfoliate and Refine Pores,6,Polycyclopentadiene,21506,495,5,5751,2040,0.354720918,1
L'Or√©al Paris,Elvital Dream Length Super D√©montage 250 ml,7,Polybutene,7416,492,10,6040,1970,0.32615894,1
L'Or√©al Paris,Men Expert Invincible Sport Deodorant Roller 50 ml,3,Polybutene,14379,492,5,1588,472,0.297229219,1
L'Or√©al Paris,La Terra Bronzer Bronze Face And Body Powder 18 g,5,Polybutene,12504,492,5,1190,488,0.410084034,1
L'Or√©al Paris,Colorista Washout Haarverf Rood 1tot2 Weken Kleuring 1 stk,7,Polybutene,5055,492,1,6040,1970,0.32615894,1
L'Or√©al Paris,Colorista Washout Haarverf Pink 1tot2 Weken Kleuring 1 stk,7,Polybutene,5054,492,5,6040,1970,0.32615894,1
L'Or√©al Paris,Botanicals Fresh Care Geranium Hair Conditioner 200 ml,7,Polybutene,3597,492,9,6040,1970,0.32615894,1
L'Or√©al Paris,Elvital Multivitamin Pflege-Shampoo 250 ml,7,Polybutene,7439,492,5,6040,1970,0.32615894,1
L'Or√©al Paris,Studio Line Go Create Spray 6,7,Polybutene,22764,492,5,6040,1970,0.32615894,1
L'Or√©al Paris,Make-Up Designer False Lash Superstar Black Wimpermascara 13 ml,4,Polybutene,13613,492,5,630,234,0.371428571,1
L'Or√©al Paris,Sublime Body Nutrition Royale Lait Fondant [Body Lotion],1,Polybutene,22955,492,10,5393,1941,0.359910996,1
L'Or√©al Paris,Age Perfect Day Cream 50 ml,6,Polybutene,674,492,8,5751,2040,0.354720918,1
L'Or√©al Paris,Elvital Color-Gloss Shampoo,7,Polybutene,7396,492,7,6040,1970,0.32615894,1
L'Or√©al Paris,True Match The One Concealer 4N Beige 6.8 ml,5,Polyaminopropyl Biguanide,25168,490,3,1190,488,0.410084034,1
L'Or√©al Paris,Expert Anti-Age 45+ 50 ml,6,Polyaminopropyl Biguanide,7892,490,2,5751,2040,0.354720918,1
L'Or√©al Paris,Magnetic Carbon Daily Cleaner 150 ml,6,Polyaminopropyl Biguanide,13601,490,2,5751,2040,0.354720918,1
L'Or√©al Paris,Men Expert Hydra Sensitive Aftershave Balsem 100 ml,6,Polyaminopropyl Biguanide,14367,490,3,5751,2040,0.354720918,1
L'Or√©al Paris,Lineur Intense Felt Tip Liquid Eyeliner Black 1.5 ml,4,Polyaminopropyl Biguanide,12864,490,3,630,234,0.371428571,1
L'Or√©al Paris,Studio Line Fixatie & Style Styling Gel 150 ml,7,Polyaminopropyl Biguanide,22754,490,2,6040,1970,0.32615894,1
L'Or√©al Paris,Revitalift Night Cream 50 ml,6,Polyaminopropyl Biguanide,19441,490,6,5751,2040,0.354720918,1
L'Or√©al Paris,Age Perfect BB Cover Get√∂ntes Feuchtigkeitsserum 01 Light Ivory 30 ml,5,Polyaminopropyl Biguanide,666,490,2,1190,488,0.410084034,1
L'Or√©al Paris,Hyaluron Expert Night 50 ml,6,Polyaminopropyl Biguanide,11087,490,2,5751,2040,0.354720918,1
L'Or√©al Paris,Elvital Hoitoaine Color-Vive Balsam 50 ml,7,Polyaminopropyl Biguanide,7435,490,2,6040,1970,0.32615894,1
L'Or√©al Paris,Triple Active Protecting Day Cream 50ml,6,Polyaminopropyl Biguanide,25098,490,3,5751,2040,0.354720918,1
L'Or√©al Paris,Age Perfect Cell Renaissance Midnight Serum 1 stk,6,Polyaminopropyl Biguanide,667,490,2,5751,2040,0.354720918,1
L'Or√©al Paris,Hair Makeup Temporary 1-Day Hair Color Spray 57 g,7,Polyaminopropyl Biguanide,10101,490,5,6040,1970,0.32615894,1
L'Or√©al Paris,Men Expert face scrub Pure Charcoal,6,Polyamide-8,14317,489,2,5751,2040,0.354720918,1
L'Or√©al Paris,Skin Expert Micellar Water - Dry and Sensitive Skin,6,Polyamide-8,21556,489,2,5751,2040,0.354720918,1
L'Or√©al Paris,Men Expert face scrub Pure Charcoal,6,Polyamide,14317,485,2,5751,2040,0.354720918,1
L'Or√©al Paris,Skin Expert Micellar Water - Dry and Sensitive Skin,6,Polyamide,21556,485,2,5751,2040,0.354720918,1
L'Or√©al Paris,Stylista The ShortHair Cream-Wax 75 ml,7,Polyacrylate-3,22940,477,3,6040,1970,0.32615894,1
L'Or√©al Paris,Poudre Fondante Accord Parfait Beige Ros√© 9 g,5,Polyacrylate-3,17836,477,9,1190,488,0.410084034,1
L'Or√©al Paris,Studio Line Wax Fix & Shine High Gloss 75 ml,7,Polyacrylate-3,22818,477,2,6040,1970,0.32615894,1
L'Or√©al Paris,Air Volume Mega Mascara Black 9.4 ml,4,Polyacrylate-3,749,477,12,630,234,0.371428571,1
L'Or√©al Paris,Men Expert Extreme Fix Indestructible Ultra Strong Gel 150 ml,7,Polyacrylate-3,14314,477,3,6040,1970,0.32615894,1
L'Or√©al Paris,Sublime Sun After Sun 200 ml,14,Polyacrylate-3,22966,477,3,2106,763,0.362298196,1
L'Or√©al Paris,Hydra Genius Aloe Water 100 ml,6,Polyacrylate-3,11151,477,16,5751,2040,0.354720918,1
L'Or√©al Paris,Men Expert Barber Club Exfoliating Scrub 100 ml,6,Polyacrylate-3,14277,477,3,5751,2040,0.354720918,1
L'Or√©al Paris,Revitalift Laser X3 Anti-Ageing Power Serum,6,Polyacrylate-13,19431,474,7,5751,2040,0.354720918,1
L'Or√©al Paris,Botanicals Fresh Care Haarkur Saflorbl√ºte Reichhaltige N√§hrung Seidige Haar-Cr√®me 125 ml,7,Polyacrylamide,3598,471,4,6040,1970,0.32615894,1
L'Or√©al Paris,Pure Clay Soothing Face Mask 50 ml,6,Polyacrylamide,18466,471,5,5751,2040,0.354720918,1
L'Or√©al Paris,La Petite Eyeshadow Palette Nudist 02,4,Polyacrylamide,12498,471,5,630,234,0.371428571,1
L'Or√©al Paris,Age Perfect Cell Renaissance Nachtcreme 50 ml,6,Polyacrylamide,668,471,7,5751,2040,0.354720918,1
L'Or√©al Paris,Elvital Volume-Collagen Shampoo 300 ml,7,Polyacrylamide,7454,471,7,6040,1970,0.32615894,1
L'Or√©al Paris,Pr√©f√©rence 4.5 Mahonie Middenbruin Haarverf met Color Extender 1 stk,7,Polyacrylamide,18304,471,6,6040,1970,0.32615894,1
L'Or√©al Paris,Magic Retouch Instant Root Concealer Spray Brown 75 ml,7,Polyacrylamide,13561,471,5,6040,1970,0.32615894,1
L'Or√©al Paris,Elvital Color-Vive Shampoo 400 ml,7,Polyacrylamide,7400,471,5,6040,1970,0.32615894,1
L'Or√©al Paris,Age Perfect Anti-Rimpel Oogcr√®me 15 ml,6,Polyacrylamide,665,471,7,5751,2040,0.354720918,1
L'Or√©al Paris,Glam Bronze La Terra 04 Taormina Gezichtspoeder 1 stk,5,Polyacrylamide,9615,471,10,1190,488,0.410084034,1
L'Or√©al Paris,Studio Line Hot & Straight Cream 200 ml,7,Polyacrylamide,22768,471,6,6040,1970,0.32615894,1
L'Or√©al Paris,True Match Minerals Poeder Foundation N6 Honey Glow 10 g,5,Polyacrylamide,25160,471,5,1190,488,0.410084034,1
L'Or√©al Paris,Elnett Satin Kleurbescherming Haarspray 400 ml,7,Polyacrylamide,7361,471,5,6040,1970,0.32615894,1
L'Or√©al Paris,Excellence Cr√®me Verzorgende Cr√®mekleuring 5.3 Licht Goudbruin,7,Polyacrylamide,7844,471,5,6040,1970,0.32615894,1
L'Or√©al Paris,Stylista The Beach Wave Hair Styling Mist 200 ml,7,Polyacrylamide,22930,471,9,6040,1970,0.32615894,1
L'Or√©al Paris,Dermo-Expertise Gentle Lip and Eye make up Remover for Waterproof Makeup,6,Polyacrylamide,6544,471,4,5751,2040,0.354720918,1
L'Or√©al Paris,Creme Facial Anti-idade Laser X3 50ml,6,Polyacrylamide,5551,471,7,5751,2040,0.354720918,1
L'Or√©al Paris,Revitalift Anti-Wrinkle Night Cream 50ml,6,Polyacrylamide,19407,471,4,5751,2040,0.354720918,1
L'Or√©al Paris,Elvital Extraordinary Oil Coconut Shampoo 500 ml,7,Polyacrylamide,7423,471,5,6040,1970,0.32615894,1
L'Or√©al Paris,EverPure Moisture Conditioner 250 ml,7,Polyacrylamide,7801,471,5,6040,1970,0.32615894,1
L'Or√©al Paris,Color Queen Eyeshadow Superior Matte 10 ml,4,Polyacrylamide,5000,471,5,630,234,0.371428571,1
L'Or√©al Paris,Men Expert Barberclub Matte Molding Clay 75 ml,7,Polyacrylamide,14286,471,5,6040,1970,0.32615894,1
L'Or√©al Paris,Studio Line Indestructible Sculpting Wax,7,Polyacrylamide,22774,471,5,6040,1970,0.32615894,1
L'Or√©al Paris,Makeup Infallible Pro-Spray & Set Makeup Extender Setting Spray,5,Polyacrylamide,13644,471,5,1190,488,0.410084034,1
