brand,product,product_type,ingredients,p_id,i_id,n_ingre,n_product,mp_count,mp_percent,mp_present
L'Or√©al Paris,Eversleek Keratin Caring Conditioner 250 ml,7,none,7806,272,0,6040,1970,0.32615894,0
L'Or√©al Paris,24h Infallible Foundation 30 Ml - Golden Sand Number 200,5,none,143,272,0,1190,488,0.410084034,0
L'Or√©al Paris,C'est Magic BB Cream - 02 Light - 30 ml,5,none,3759,272,0,1190,488,0.410084034,0
L'Or√©al Paris,Studio Line Gel FX 8 - 150 ml,7,none,22756,272,0,6040,1970,0.32615894,0
L'Or√©al Paris,Elnett Heat defense spray volume 170 ml,7,none,7347,272,0,6040,1970,0.32615894,0
L'Or√©al Paris,Studio Line Special FX Remix Paste 150 ml,7,none,22809,272,0,6040,1970,0.32615894,0
L'Or√©al Paris,White Perfect Night Cream 50 ml,6,none,26494,272,0,5751,2040,0.354720918,0
L'Or√©al Paris,Botanicals Geranium Radiance Remedy Shampoo,7,none,3605,272,0,6040,1970,0.32615894,0
L'Or√©al Paris,Smooth Sugars Clearing Sugar Scrub,6,none,21970,272,0,5751,2040,0.354720918,0
L'Or√©al Paris,Revilalift Eye Contour Cream,6,none,19405,272,0,5751,2040,0.354720918,0
L'Or√©al Paris,Elvital Color-Gloss 2in1 Shampoo & Conditioner,7,none,7395,272,0,6040,1970,0.32615894,0
L'Or√©al Paris,Infallible Nudist Matte Lip Paint - 211,11,none,11545,272,0,694,255,0.367435159,0
L'Or√©al Paris,Men Expert Hydra Power Watery Foaming Gel,6,none,14363,272,0,5751,2040,0.354720918,0
L'Or√©al Paris,Men Expert Soap,6,none,14411,272,0,5751,2040,0.354720918,0
L'Or√©al Paris,Men Expert Pure & Matte Oak Charcoal Anti-Blackhead Scrub,6,none,14387,272,0,5751,2040,0.354720918,0
L'Or√©al Paris,Eye make-up remover,4,none,8107,272,0,630,234,0.371428571,0
L'Or√©al Paris,BB Cream C'est Magique Light to Medium,5,none,2598,272,0,1190,488,0.410084034,0
L'Or√©al Paris,Elvital Shampoo Planta Clear Anti Dandruff 2in1,7,none,7447,272,0,6040,1970,0.32615894,0
L'Or√©al Paris,Men Expert Hydra Energetic Hydraterende Gezichtscr√®me,6,none,14341,272,0,5751,2040,0.354720918,0
L'Or√©al Paris,Revitalift Filler Anti-Rimpel Dagcr√®me,6,none,19418,272,0,5751,2040,0.354720918,0
L'Or√©al Paris,Delicate Flowers Milk,6,none,6167,272,0,5751,2040,0.354720918,0
L'Or√©al Paris,Men Expert Pure & Matte Charcoal Black Scrub,6,none,14385,272,0,5751,2040,0.354720918,0
L'Or√©al Paris,Exfoliating gel pure clays,6,none,7876,272,0,5751,2040,0.354720918,0
L'Or√©al Paris,Infallible Fresh Wear Foundation 24Hr 445 Vanilla,5,none,11540,272,0,1190,488,0.410084034,0
L'Or√©al Paris,Men Expert Fresh Extreme Deodorant,3,none,14322,272,0,1588,472,0.297229219,0
L'Or√©al Paris,Glam Nude - Nude Magique BB Cream - Medium to Dark - Foundation SPF12,5,none,9618,272,0,1190,488,0.410084034,0
L'Or√©al Paris,Infalible 24H Matte Cover Makeup base - 155: Natural Rose,5,none,11536,272,0,1190,488,0.410084034,0
L'Or√©al Paris,Infaillible 24Hr Fresh Wear Foundation 20 Ivory,5,none,11530,272,0,1190,488,0.410084034,0
L'Or√©al Paris,Men Expert Pure Amp Matte Face Scrub,6,none,14388,272,0,5751,2040,0.354720918,0
L'Or√©al Paris,Men Expert Hydra Sensitive Cleansing Foaming Gel,6,none,14369,272,0,5751,2040,0.354720918,0
L'Or√©al Paris,Hydra Genius Daily Liquid Care Normal Oily,6,none,11153,272,0,5751,2040,0.354720918,0
L'Or√©al Paris,C'est Magic BB Cream Medium,5,none,3762,272,0,1190,488,0.410084034,0
L'Or√©al Paris,Super Liner Perfect Slim Eyeliner - Black,4,none,23768,272,0,630,234,0.371428571,0
L'Or√©al Paris,Crema D√≠a Revitalift √Åcido Hialur√≥nico,6,none,5483,272,0,5751,2040,0.354720918,0
L'Or√©al Paris,Studio Line Invisi Fix Gel Fixative,7,none,22783,272,0,6040,1970,0.32615894,0
L'Or√©al Paris,Volume Million Lashes Excess Mascara Black,4,none,26208,272,0,630,234,0.371428571,0
L'Or√©al Paris,Magic Retouch Instant Ruibio Oscuro/dark Blonde Root Spray,7,none,13562,272,0,6040,1970,0.32615894,0
L'Or√©al Paris,Elvital Anti-Haarbruch pflegende Aufbau-Sp√ºlung,7,none,7386,272,0,6040,1970,0.32615894,0
L'Or√©al Paris,Men Expert Hydra Sensitive After Shave,6,none,14366,272,0,5751,2040,0.354720918,0
L'Or√©al Paris,Make-Up Designer Paradise Extatic 01 Black Mascara,4,none,13616,272,0,630,234,0.371428571,0
L'Or√©al Paris,True Match Foundation - Beige,5,none,25148,272,0,1190,488,0.410084034,0
L'Or√©al Paris,True Match Highlighter - 301 Rose Glace,5,none,25157,272,0,1190,488,0.410084034,0
L'Or√©al Paris,Men Expert Pure Charcoal 100 ml,6,none,14390,272,0,5751,2040,0.354720918,0
L'Or√©al Paris,Elnett Satin Normale Fixatie Haarspray 200 ml,7,none,7366,272,0,6040,1970,0.32615894,0
L'Or√©al Paris,Age Perfect Dagcr√®me Manuka Honing 50 ml,6,none,673,272,0,5751,2040,0.354720918,0
L'Or√©al Paris,Skin Sugar Scrubs Kiwi Zuiverend 50 ml,6,none,21685,272,0,5751,2040,0.354720918,0
L'Or√©al Paris,Skin Expert Delicate Flowers Soft Dry and sensitive skin Tonic 400 ml,6,none,21553,272,0,5751,2040,0.354720918,0
L'Or√©al Paris,Pure Clay Face Wash 150 ml,6,none,18459,272,0,5751,2040,0.354720918,0
L'Or√©al Paris,Infaillible 24H Foundation 145 Rose Beige 30 ml,5,none,11525,272,0,1190,488,0.410084034,0
L'Or√©al Paris,Botanicals Ginger & Coriander Conditioner 200 ml,7,none,3606,272,0,6040,1970,0.32615894,0
L'Or√©al Paris,Hydra Genius Day Cream 70 ml,6,none,11154,272,0,5751,2040,0.354720918,0
L'Or√©al Paris,Skin Expert Revitalif 30+ Serum Hydrating Smoothing Anti-Wrinkle 30 ml,6,none,21560,272,0,5751,2040,0.354720918,0
L'Or√©al Paris,Skin Expert Golden Age 50 ml,6,none,21555,272,0,5751,2040,0.354720918,0
L'Or√©al Paris,Age Perfect Golden Age Day Cream 50 ml,6,none,681,272,0,5751,2040,0.354720918,0
L'Or√©al Paris,Sublime Sun Sublime Bronze Serum 100 ml,6,none,22974,272,0,5751,2040,0.354720918,0
L'Or√©al Paris,Extraordinary Oil Nourishing Oil-Cream 50 ml,6,none,8053,272,0,5751,2040,0.354720918,0
L'Or√©al Paris,Skin Expert Age Perfect Golden Age Day Cream Fortifying SPF 20 50 ml,6,none,21551,272,0,5751,2040,0.354720918,0
L'Or√©al Paris,Magic Retouch Bruin 75 ml,7,none,13555,272,0,6040,1970,0.32615894,0
L'Or√©al Paris,Elnett Satin Cr√©me de Mousse 200 ml,7,none,7351,272,0,6040,1970,0.32615894,0
L'Or√©al Paris,Studio Line Essentials Invisi Fix 24H Micro-Diffusion Spray 250 ml,7,none,22747,272,0,6040,1970,0.32615894,0
L'Or√©al Paris,Men Expert Cooling Face Gel Hydra Energetic for normal and dry skin 50 ml,6,none,14295,272,0,5751,2040,0.354720918,0
L'Or√©al Paris,Men Expert Hydra Energetic Eye Roller 10 ml,6,none,14333,272,0,5751,2040,0.354720918,0
L'Or√©al Paris,Face Cream Revitalift Laser 50 ml,6,none,8201,272,0,5751,2040,0.354720918,0
L'Or√©al Paris,True Match Foundation C2 Rose Vanilla Powder 9 g,5,none,25155,272,0,1190,488,0.410084034,0
L'Or√©al Paris,Elnett Mousse Extra Strong 200 ml,7,none,7349,272,0,6040,1970,0.32615894,0
L'Or√©al Paris,Men Expert Pure Power Foaming Gel 150 ml,6,none,14397,272,0,5751,2040,0.354720918,0
L'Or√©al Paris,Men Expert Hydra Energetic Gezichtsreiniger face washing/cleansing gel 150 ml,6,none,14339,272,0,5751,2040,0.354720918,0
L'Or√©al Paris,Desmaquillante suave ojos y labios,6,none,6640,272,0,5751,2040,0.354720918,0
L'Or√©al Paris,Elvital Oil Magique Conditioner,7,none,7441,272,0,6040,1970,0.32615894,0
L'Or√©al Paris,Studio line mineral FX sculpting paste 75 ml,7,none,22795,272,0,6040,1970,0.32615894,0
L'Or√©al Paris,Studio Line Invisi Fix 24h Clear & Clean Gel 150 ml,7,none,22778,272,0,6040,1970,0.32615894,0
L'Or√©al Paris,Botanicals Fresh Care Argan & Safflower Shampoo 400 ml,7,none,3594,272,0,6040,1970,0.32615894,0
L'Or√©al Paris,Stylista The Curl Tonic Haarspray 200 ml,7,none,22939,272,0,6040,1970,0.32615894,0
L'Or√©al Paris,Elvine Full Resist Conditioner 200 ml,7,none,7379,272,0,6040,1970,0.32615894,0
L'Or√©al Paris,Men Expert Fresh Extreme 48H Deodorant Roller - 50 ml,3,none,14321,272,0,1588,472,0.297229219,0
L'Or√©al Paris,Men Expert Extreme Fresh Deospray,3,none,14316,272,0,1588,472,0.297229219,0
L'Or√©al Paris,Men Expert Deodorant Men Expert Thermic Resist - 50ml,3,none,14304,272,0,1588,472,0.297229219,0
L'Or√©al Paris,Men Expert Falten Stop Gesichtscreme 50 ml,6,none,14318,272,0,5751,2040,0.354720918,0
L'Or√©al Paris,True Match Powder Puder C3 Rose Beige 9 g,5,none,25161,272,0,1190,488,0.410084034,0
L'Or√©al Paris,Skin Expert Revitalift Anti-Rimpel 15 ml,6,none,21562,272,0,5751,2040,0.354720918,0
L'Or√©al Paris,Men Expert Hydra Energy Comfort Max 50 ml,6,none,14350,272,0,5751,2040,0.354720918,0
L'Or√©al Paris,Studio Line Remix Styling-Cr√®me 150 ml,7,none,22802,272,0,6040,1970,0.32615894,0
L'Or√©al Paris,Bambi Eye False Lash Waterproof Mascara 6.7 ml,4,none,2484,272,0,630,234,0.371428571,0
L'Or√©al Paris,Stylista The Bun Gel Spray 200 ml,7,none,22937,272,0,6040,1970,0.32615894,0
L'Or√©al Paris,Wrinkle Decrease Collagen Day Anti-Ageing Cream,6,none,26654,272,0,5751,2040,0.354720918,0
L'Or√©al Paris,Age Perfect Night Cream,6,none,688,272,0,5751,2040,0.354720918,0
L'Or√©al Paris,Elvital Dream Length Shampoo 400 ml,7,Microcrystalline Wax,7413,271,8,6040,1970,0.32615894,1
L'Or√©al Paris,Magic Retouch Precision Mascara Donkerblond 8 ml,7,Microcrystalline Wax,13564,271,3,6040,1970,0.32615894,1
L'Or√©al Paris,Elvital Color-Glanz Pflegeshampoo 400 ml,7,Microcrystalline Wax,7392,271,2,6040,1970,0.32615894,1
L'Or√©al Paris,Age Perfect Extra-Reichhaltig Manuka Nachtpflege 50 ml,6,Microcrystalline Wax,676,271,5,5751,2040,0.354720918,1
L'Or√©al Paris,Pr√©f√©rence 4.5 Mahonie Middenbruin Haarverf met Color Extender 1 stk,7,Microcrystalline Wax,18304,271,6,6040,1970,0.32615894,1
L'Or√©al Paris,Age Perfect Golden Lotion Serum 30 ml,6,Microcrystalline Wax,686,271,6,5751,2040,0.354720918,1
L'Or√©al Paris,Magic Retouch Braun bis Mittelbraun 75 ml,7,Microcrystalline Wax,13553,271,6,6040,1970,0.32615894,1
L'Or√©al Paris,Studio Line Cire Sculptante Indestructible 75 ml,7,Microcrystalline Wax,22741,271,6,6040,1970,0.32615894,1
L'Or√©al Paris,Men Expert Vita Lift Reinigingscr√®me 150 ml,6,Microcrystalline Wax,14421,271,3,5751,2040,0.354720918,1
L'Or√©al Paris,Revitalift Klassik Reinigungsmilch 200 ml,6,Microcrystalline Wax,19429,271,6,5751,2040,0.354720918,1
L'Or√©al Paris,Elnett Haarspray Volumen 250 ml,7,Microcrystalline Wax,7346,271,8,6040,1970,0.32615894,1
L'Or√©al Paris,Magic Shampoo Such√Ω ≈†ampon na Vlasy Citrus Wave 200 ml,7,Microcrystalline Wax,13573,271,3,6040,1970,0.32615894,1
L'Or√©al Paris,Elnett Satin Extra Sterke Fixatie Haarspray,7,Microcrystalline Wax,7354,271,6,6040,1970,0.32615894,1
L'Or√©al Paris,Skin Expert Age Expert 45+ 50 ml,6,Microcrystalline Wax,21546,271,9,5751,2040,0.354720918,1
L'Or√©al Paris,"Men Expert Deo Spray Invincible Sport, 150ml",3,Microcrystalline Wax,14301,271,8,1588,472,0.297229219,1
L'Or√©al Paris,Infallible Matte Foundation - Natural Beige 105,5,Microcrystalline Wax,11542,271,5,1190,488,0.410084034,1
L'Or√©al Paris,Men Expert Hydra Energy Shower Gel,6,Microcrystalline Wax,14355,271,6,5751,2040,0.354720918,1
L'Or√©al Paris,Skin Expert Bi-fase Micellair Water 400 ml,6,Microcrystalline Wax,21552,271,3,5751,2040,0.354720918,1
L'Or√©al Paris,Men Expert Hydra Energetic Tattoo Reviver Lotion,1,Microcrystalline Wax,14349,271,5,5393,1941,0.359910996,1
L'Or√©al Paris,Magic Retouch Uitgroeispray Middenbruin 75 ml,7,Microcrystalline Wax,13571,271,1,6040,1970,0.32615894,1
L'Or√©al Paris,Colorista Wash Out Spray Tom 7 Turquoise 75 ml,7,Methylsilanol/silicate Crosspolymer,5051,270,4,6040,1970,0.32615894,1
L'Or√©al Paris,Wrinkle Expert 65+ Anti-Rimpel Dagcr√®me 50 ml,6,Methylsilanol/silicate Crosspolymer,26657,270,5,5751,2040,0.354720918,1
L'Or√©al Paris,Revitalift Laser X3 Crema Dia 50 ml,6,Methylsilanol/silicate Crosspolymer,19435,270,4,5751,2040,0.354720918,1
L'Or√©al Paris,Elnett Satin Luminize Haarspray 400 ml,7,Methyl Trimethicone,7364,269,1,6040,1970,0.32615894,1
L'Or√©al Paris,Elnett Satin Normale Fixatie Hairspray 400 ml,7,Methyl Trimethicone,7368,269,2,6040,1970,0.32615894,1
L'Or√©al Paris,Elnett Satin Volume Fixatie 400 ml,7,Methyl Trimethicone,7374,269,2,6040,1970,0.32615894,1
L'Or√©al Paris,Elnett Satin Extra Sterke Fixatie Haarlak 400 ml,7,Methyl Trimethicone,7353,269,2,6040,1970,0.32615894,1
L'Or√©al Paris,Studio Line Wave Creating Hair Spray 150 ml,7,Methyl Trimethicone,22817,269,2,6040,1970,0.32615894,1
L'Or√©al Paris,Studio Line Fix & Shine 24H Fixing Mousse 200 ml,7,Methyl Trimethicone,22750,269,8,6040,1970,0.32615894,1
L'Or√©al Paris,Studio Line Mineral & Control 150 ml,7,Methyl Trimethicone,22792,269,8,6040,1970,0.32615894,1
L'Or√©al Paris,Pr√©f√©rence 7 Midden Blond Haarverf met Color Extender 1 stk,7,Methyl Trimethicone,18306,269,1,6040,1970,0.32615894,1
L'Or√©al Paris,Elvital Color Vive Balsam 250 ml,7,Methyl Trimethicone,7402,269,2,6040,1970,0.32615894,1
L'Or√©al Paris,Elvital Color-Vive Balsam 400 ml,7,Methyl Trimethicone,7397,269,2,6040,1970,0.32615894,1
L'Or√©al Paris,R√©vitalift Nachtcr√®me Revitalift Anti-Aging 50 ml,6,Methyl Trimethicone,19819,269,2,5751,2040,0.354720918,1
L'Or√©al Paris,Elnett Satin Extra Sterk Haarspray,7,Methyl Trimethicone,7352,269,11,6040,1970,0.32615894,1
L'Or√©al Paris,Elnett - Satin Volume Haarspray Extra Sterk,7,Methyl Trimethicone,7336,269,2,6040,1970,0.32615894,1
L'Or√©al Paris,Studio Line Clear Minded Clean Gel 6.8 oz,7,Methyl Trimethicone,22742,269,2,6040,1970,0.32615894,1
L'Or√©al Paris,"Bonjour Nudista Skin Tint, Medium Cream",5,Methyl Trimethicone,3465,269,2,1190,488,0.410084034,1
L'Or√©al Paris,Pr√©f√©rence Permanente Haarkleuring Feria Color 7.4 Mango,7,Methyl Trimethicone,18312,269,2,6040,1970,0.32615894,1
L'Or√©al Paris,Studio Line Matt & Messy 150 ml,7,Methyl Methacrylate Crosspolymer,22786,266,5,6040,1970,0.32615894,1
L'Or√©al Paris,Age Perfect Eye Cream 15 ml,6,Methyl Methacrylate Crosspolymer,678,266,6,5751,2040,0.354720918,1
L'Or√©al Paris,Revitalift Filler Revolumising Day Cream 50 ml,6,Methyl Methacrylate Crosspolymer,19426,266,6,5751,2040,0.354720918,1
L'Or√©al Paris,Lait Cellular Protect Sublime Sun SPF50 200 ml,14,Methyl Methacrylate Crosspolymer,12526,266,6,2106,763,0.362298196,1
L'Or√©al Paris,Cell Renaissance Oogcr√®me 15 ml,6,Methyl Methacrylate Crosspolymer,4048,266,5,5751,2040,0.354720918,1
L'Or√©al Paris,Wrinkle Expert Night 45+ 50 ml,6,Methyl Methacrylate Crosspolymer,26660,266,5,5751,2040,0.354720918,1
L'Or√©al Paris,Revitalift Filler Soin Yeux Revolumisant 15 ml,6,Methyl Methacrylate Crosspolymer,19427,266,5,5751,2040,0.354720918,1
L'Or√©al Paris,Studio Line Go Create Spray Coiffant Fixation Ultra Forte 150 ml,7,Methyl Methacrylate Crosspolymer,22765,266,5,6040,1970,0.32615894,1
L'Or√©al Paris,Accord Parfait 3.D Beige Ros√© 30 ml,5,Methyl Methacrylate Crosspolymer,330,266,4,1190,488,0.410084034,1
L'Or√©al Paris,Men Expert After Shave Reparierender Balsam 24h Feuchtigkeit 100 ml,6,Methyl Methacrylate Crosspolymer,14266,266,6,5751,2040,0.354720918,1
L'Or√©al Paris,Men Expert Hydra Energetic Aftershave Gel 100 ml,6,Methyl Methacrylate Crosspolymer,14328,266,5,5751,2040,0.354720918,1
L'Or√©al Paris,Revitalift Re-Support Anti-Wrinkle Cream 50 ml,6,Methyl Methacrylate Crosspolymer,19442,266,6,5751,2040,0.354720918,1
L'Or√©al Paris,Sublime Bronze Self-Tanning Perfector & Corrector 8 x 2 ml,5,Methyl Methacrylate Crosspolymer,22956,266,3,1190,488,0.410084034,1
L'Or√©al Paris,Studio Line Super Fix & Style Gel Super Strong 150 ml,7,Methyl Methacrylate Crosspolymer,22813,266,4,6040,1970,0.32615894,1
L'Or√©al Paris,Excellenc Creme 5 Bruin Haarverf 1 stk,7,Methyl Methacrylate Crosspolymer,7830,266,6,6040,1970,0.32615894,1
L'Or√©al Paris,Elvital Full Resist Multi Power Haarkur 680 ml,7,Methyl Methacrylate Crosspolymer,7429,266,5,6040,1970,0.32615894,1
L'Or√©al Paris,Infaillible Matte Cover 260 Soleil 30 ml,5,Methyl Methacrylate Crosspolymer,11532,266,6,1190,488,0.410084034,1
L'Or√©al Paris,Men Expert Hydra Energetic Scrub 100 ml,6,Methyl Methacrylate Crosspolymer,14346,266,5,5751,2040,0.354720918,1
L'Or√©al Paris,Elnett Satin Normale Fixatie Hairspray,7,Methyl Methacrylate Crosspolymer,7367,266,7,6040,1970,0.32615894,1
L'Or√©al Paris,Revitalift Anti-Wrinkle Day Cream (Fragrance-Free),6,Methyl Methacrylate Crosspolymer,19406,266,7,5751,2040,0.354720918,1
L'Or√©al Paris,Revitalift Filler cushioning mask,6,Methyl Methacrylate Crosspolymer,19419,266,9,5751,2040,0.354720918,1
L'Or√©al Paris,True Match Foundation 1W Golden Ivory 30 ml,5,Methyl Methacrylate Crosspolymer,25150,266,5,1190,488,0.410084034,1
L'Or√©al Paris,Brow Stylist Boost & Set Brow Mascara Light Brunette 480 3.2 ml,4,Methyl Methacrylate Crosspolymer,3710,266,9,630,234,0.371428571,1
L'Or√©al Paris,Anti Wrinkle CICA Cream Extra Recovery 40 ml,6,Magnesium Laureth-8 Sulfate,1599,260,4,5751,2040,0.354720918,1
L'Or√©al Paris,Age Expert 55+ Anti Rimpel Dagcr√®me 50 ml,6,Magnesium Laureth-8 Sulfate,662,260,4,5751,2040,0.354720918,1
L'Or√©al Paris,Men Expert Pure and Matte Desert Clay Yellow Foam,6,Magnesium Laureth-8 Sulfate,14389,260,4,5751,2040,0.354720918,1
L'Or√©al Paris,Studio Line Fix & Shine 24H Fixing Mousse 200 ml,7,Lauryl PEG-9 polydimethylsiloxyethyl dimethicone,22750,256,8,6040,1970,0.32615894,1
L'Or√©al Paris,Studio Line Mineral & Control 150 ml,7,Lauryl PEG-9 polydimethylsiloxyethyl dimethicone,22792,256,8,6040,1970,0.32615894,1
L'Or√©al Paris,Sublime Sun Mythical Bronze 150 ml,14,Lauryl PEG-9 polydimethylsiloxyethyl dimethicone,22970,256,3,2106,763,0.362298196,1
L'Or√©al Paris,Men Expert Hydra Energetic Hydraterende Gezichtscr√®me 100 ml,6,Lauryl PEG-9 polydimethylsiloxyethyl dimethicone,14342,256,3,5751,2040,0.354720918,1
L'Or√©al Paris,Back To Bronze Matte Bronzing Powder,5,Lauryl PEG-9 polydimethylsiloxyethyl dimethicone,2375,256,3,1190,488,0.410084034,1
L'Or√©al Paris,Magic Shampoo Such√Ω ≈†ampon na Vlasy Citrus Wave 200 ml,7,Lauryl Methacrylate/Glycol Dimethacrylate Crosspolymer,13573,252,3,6040,1970,0.32615894,1
L'Or√©al Paris,Age Expert 55+ Anti Rimpel Dagcr√®me 50 ml,6,Laureth-8,662,249,4,5751,2040,0.354720918,1
L'Or√©al Paris,Men Expert Pure and Matte Desert Clay Yellow Foam,6,Laureth-8,14389,249,4,5751,2040,0.354720918,1
L'Or√©al Paris,Botanicals Fresh Care Haarkur Saflorbl√ºte Reichhaltige N√§hrung Seidige Haar-Cr√®me 125 ml,7,Laureth-7,3598,247,4,6040,1970,0.32615894,1
L'Or√©al Paris,Pure Clay Soothing Face Mask 50 ml,6,Laureth-7,18466,247,5,5751,2040,0.354720918,1
L'Or√©al Paris,La Petite Eyeshadow Palette Nudist 02,4,Laureth-7,12498,247,5,630,234,0.371428571,1
L'Or√©al Paris,Age Perfect Cell Renaissance Nachtcreme 50 ml,6,Laureth-7,668,247,7,5751,2040,0.354720918,1
L'Or√©al Paris,Elvital Volume-Collagen Shampoo 300 ml,7,Laureth-7,7454,247,7,6040,1970,0.32615894,1
L'Or√©al Paris,Pr√©f√©rence 4.5 Mahonie Middenbruin Haarverf met Color Extender 1 stk,7,Laureth-7,18304,247,6,6040,1970,0.32615894,1
L'Or√©al Paris,Magic Retouch Instant Root Concealer Spray Brown 75 ml,7,Laureth-7,13561,247,5,6040,1970,0.32615894,1
L'Or√©al Paris,Elvital Color-Vive Shampoo 400 ml,7,Laureth-7,7400,247,5,6040,1970,0.32615894,1
L'Or√©al Paris,Age Perfect Anti-Rimpel Oogcr√®me 15 ml,6,Laureth-7,665,247,7,5751,2040,0.354720918,1
L'Or√©al Paris,Glam Bronze La Terra 04 Taormina Gezichtspoeder 1 stk,5,Laureth-7,9615,247,10,1190,488,0.410084034,1
L'Or√©al Paris,Studio Line Hot & Straight Cream 200 ml,7,Laureth-7,22768,247,6,6040,1970,0.32615894,1
L'Or√©al Paris,Revitalift Klassik Reinigungsmilch 200 ml,6,Laureth-7,19429,247,6,5751,2040,0.354720918,1
L'Or√©al Paris,True Match Minerals Poeder Foundation N6 Honey Glow 10 g,5,Laureth-7,25160,247,5,1190,488,0.410084034,1
L'Or√©al Paris,Studio Line Go Create Sculpting Spritz 150 ml,7,Laureth-7,22763,247,4,6040,1970,0.32615894,1
L'Or√©al Paris,Elnett Satin Kleurbescherming Haarspray 400 ml,7,Laureth-7,7361,247,5,6040,1970,0.32615894,1
L'Or√©al Paris,Excellence Cr√®me Verzorgende Cr√®mekleuring 5.3 Licht Goudbruin,7,Laureth-7,7844,247,5,6040,1970,0.32615894,1
L'Or√©al Paris,Stylista The Beach Wave Hair Styling Mist 200 ml,7,Laureth-7,22930,247,9,6040,1970,0.32615894,1
L'Or√©al Paris,Dermo-Expertise Gentle Lip and Eye make up Remover for Waterproof Makeup,6,Laureth-7,6544,247,4,5751,2040,0.354720918,1
L'Or√©al Paris,Creme Facial Anti-idade Laser X3 50ml,6,Laureth-7,5551,247,7,5751,2040,0.354720918,1
L'Or√©al Paris,Revitalift Anti-Wrinkle Night Cream 50ml,6,Laureth-7,19407,247,4,5751,2040,0.354720918,1
L'Or√©al Paris,Elvital Extraordinary Oil Coconut Shampoo 500 ml,7,Laureth-7,7423,247,5,6040,1970,0.32615894,1
L'Or√©al Paris,EverPure Moisture Conditioner 250 ml,7,Laureth-7,7801,247,5,6040,1970,0.32615894,1
L'Or√©al Paris,Color Queen Eyeshadow Superior Matte 10 ml,4,Laureth-7,5000,247,5,630,234,0.371428571,1
L'Or√©al Paris,Studio Line Indestructible Sculpting Wax,7,Laureth-7,22774,247,5,6040,1970,0.32615894,1
L'Or√©al Paris,Makeup Infallible Pro-Spray & Set Makeup Extender Setting Spray,5,Laureth-7,13644,247,5,1190,488,0.410084034,1
L'Or√©al Paris,Dermo-Expertise White Perfect Whitening & Moisturizing Toner,1,Laureth-7,6547,247,5,5393,1941,0.359910996,1
L'Or√©al Paris,Age Perfect - Re-hydrating Night Cream,6,Laureth-7,664,247,3,5751,2040,0.354720918,1
L'Or√©al Paris,Elvital Dream Length No Haircut,7,Laureth-7,7409,247,2,6040,1970,0.32615894,1
L'Or√©al Paris,Revitalift Red Cream Day cream 50 ml,6,Laureth-7,19443,247,5,5751,2040,0.354720918,1
L'Or√©al Paris,Reinigungsgel Men Expert Hydra Energetic Droge huid 100 ml,7,Laureth-7,19116,247,7,6040,1970,0.32615894,1
L'Or√©al Paris,Age Perfect Day Cream for mature skin 50 ml,6,Laureth-7,675,247,8,5751,2040,0.354720918,1
L'Or√©al Paris,Micellaire Gel√©e 125 ml,4,Laureth-5,14891,245,5,630,234,0.371428571,1
L'Or√©al Paris,Colorista Washout Denim Blue 80 ml,7,Laureth-5,5053,245,6,6040,1970,0.32615894,1
L'Or√©al Paris,Make-Up Designer Unlimited Mascara Zwart 1 stk,4,Laureth-5,13617,245,5,630,234,0.371428571,1
L'Or√©al Paris,Elvital Full Resist Reinforcing Shampoo 500 ml,7,Laureth-5,7431,245,6,6040,1970,0.32615894,1
L'Or√©al Paris,Age Perfect Tonic Faris 200ml,6,Laureth-5,701,245,5,5751,2040,0.354720918,1
L'Or√©al Paris,Lotion Micelar Sublime & Soft Sensitive Skin 200 ml,6,Laureth-4,13217,244,5,5751,2040,0.354720918,1
L'Or√©al Paris,Magic Retouch Ansatzspray Braun bis Mittelbraun 90 ml,7,Laureth-4,13546,244,5,6040,1970,0.32615894,1
L'Or√©al Paris,Colorista Silver Shampooing 200 ml,7,Laureth-4,5046,244,8,6040,1970,0.32615894,1
L'Or√©al Paris,Kostbare Bl√ºten Waschgel 150 ml,6,Laureth-4,12424,244,7,5751,2040,0.354720918,1
L'Or√©al Paris,Magic Retouch Uitgroeispray Donkerblond 75 ml,7,Laureth-4,13570,244,6,6040,1970,0.32615894,1
L'Or√©al Paris,Men Expert Wrinkle De-Crease Day Cream 50 ml,6,Laureth-4,14423,244,6,5751,2040,0.354720918,1
L'Or√©al Paris,Bambi XXL Oversized Eye Mascara 01 Black 1 stk,4,Laureth-4,2486,244,3,630,234,0.371428571,1
L'Or√©al Paris,Extra Fine Coconut Oil Shampoo 250ml,7,Laureth-4,7969,244,7,6040,1970,0.32615894,1
L'Or√©al Paris,Stylista The Beach Wave Mist 200ml,7,Laureth-4,22931,244,5,6040,1970,0.32615894,1
L'Or√©al Paris,"Men Expert Barber Club Bart & Haar Stylingpomade, 75 ml",7,Laureth-4,14274,244,5,6040,1970,0.32615894,1
L'Or√©al Paris,Shake & Glow Spray Illuminateur 100 ml,5,Laureth-4,20554,244,6,1190,488,0.410084034,1
L'Or√©al Paris,Paris Revitalift Laser X3 Anti-Verouderingsverzorging Dag SPF20 50 ml,6,Laureth-4,17366,244,5,5751,2040,0.354720918,1
L'Or√©al Paris,Men Expert Hydra Intensive 24H day cream Dry skin 50 ml,6,Laureth-4,14356,244,6,5751,2040,0.354720918,1
L'Or√©al Paris,EverPure Moisture Leave-in Conditioner,7,Laureth-4,7802,244,6,6040,1970,0.32615894,1
L'Or√©al Paris,"Men Expert Deo Roll-on Carbon Protect, 50 ml",3,Laureth-4,14296,244,6,1588,472,0.297229219,1
L'Or√©al Paris,Studio Line Gel Mineral Invisi Fx Spray Strong 150 ml,7,Laureth-4,22760,244,5,6040,1970,0.32615894,1
L'Or√©al Paris,Studio Line Strong Fixing Styling Spray 6 150 ml,7,Laureth-3,22812,242,1,6040,1970,0.32615894,1
L'Or√©al Paris,Studio Line 48h extreme styling gel,7,Laureth-3,22738,242,1,6040,1970,0.32615894,1
L'Or√©al Paris,Botanicals Lavender Shampoo - 400 ml,7,Laureth-3,3608,242,1,6040,1970,0.32615894,1
L'Or√©al Paris,Botanicals Fresh Care Argan & Safflower Conditioner 200 ml,7,Laureth-3,3593,242,1,6040,1970,0.32615894,1
L'Or√©al Paris,Colorista Silver Shampooing 200 ml,7,Laureth-23,5046,240,8,6040,1970,0.32615894,1
L'Or√©al Paris,Kostbare Bl√ºten Waschgel 150 ml,6,Laureth-23,12424,240,7,5751,2040,0.354720918,1
L'Or√©al Paris,Magic Retouch Uitgroeispray Donkerblond 75 ml,7,Laureth-23,13570,240,6,6040,1970,0.32615894,1
L'Or√©al Paris,Zonnebrand Melk SPF50+ 150 ml,14,Laureth-23,26950,240,7,2106,763,0.362298196,1
L'Or√©al Paris,Triple Active Hydra Fresh 50 ml,6,Laureth-23,25095,240,8,5751,2040,0.354720918,1
L'Or√©al Paris,Extra Fine Coconut Oil Shampoo 250ml,7,Laureth-23,7969,240,7,6040,1970,0.32615894,1
L'Or√©al Paris,Volume Million Lashes Mascara No. Black 10.5 ml,4,Laureth-23,26213,240,4,630,234,0.371428571,1
L'Or√©al Paris,Make-Up Designer Bambi Eye By False Lash Volume Mascara Voor een Perfecte Krul Zwart 1 stuk,4,Laureth-23,13612,240,5,630,234,0.371428571,1
L'Or√©al Paris,Colorista Hair Colour Hair Make-up Blue Hair for Brunettes 30 ml,7,Laureth-21,5040,239,5,6040,1970,0.32615894,1
L'Or√©al Paris,Elvital Dream Length Super D√©montage 250 ml,7,Laureth-21,7416,239,10,6040,1970,0.32615894,1
